{
  "report_version": "1.0",
  "generated_utc": "2026-02-06T00:00:00Z",
  "total_findings": 38,
  "summary": {
    "critical": 5,
    "high": 11,
    "medium": 13,
    "low": 7,
    "info": 2
  },
  "findings": [
    {
      "id": "MMD-001",
      "severity": "HIGH",
      "category": "STALE_ARTIFACT",
      "title": "BOOT.md falsely claims *.part* and *.rtf are missing from .gitattributes",
      "description": "BOOT.md line 142-143 states '*.part* (segmented archives \u2014 CURRENTLY MISSING, must be added)' and '*.rtf (educational content \u2014 CURRENTLY MISSING, must be added)'. However, .gitattributes lines 13-14 already contain '*.part[0-9]* filter=lfs diff=lfs merge=lfs -text' and '*.rtf filter=lfs diff=lfs merge=lfs -text'. BOOT.md is stale and presents false information about the current state of the repository.",
      "affected_files": [
        ".codex/kernel/BOOT.md",
        ".gitattributes"
      ],
      "recommendation": "Remove the 'CURRENTLY MISSING, must be added' annotations from BOOT.md lines 142-143 and mark them as present. Add a staleness-detection mechanism or timestamp to BOOT.md so drift is detectable.",
      "effort": "LOW"
    },
    {
      "id": "MMD-002",
      "severity": "HIGH",
      "category": "STALE_ARTIFACT",
      "title": "BOOT_RECEIPT.json records resolved LFS gaps with no update mechanism",
      "description": "BOOT_RECEIPT.json field 'lfs_gaps_at_boot' records ['*.part* not tracked', '*.rtf not tracked']. These gaps have since been resolved in .gitattributes. The receipt reflects a prior state. There is no mechanism defined anywhere in the governance system (BOOT.md, super-prompt, or any policy) for updating, superseding, or annotating receipts when the conditions they recorded change. Receipts are write-once but the system has no concept of receipt amendment or succession.",
      "affected_files": [
        ".codex/receipts/BOOT_RECEIPT.json",
        ".codex/kernel/BOOT.md"
      ],
      "recommendation": "Define a receipt lifecycle policy: either (a) receipts are immutable snapshots and a new BOOT_RECEIPT.json is emitted when BOOT.md changes, with the old receipt archived under a timestamped name, or (b) receipts gain 'amendments' array fields for post-hoc corrections. Publish this policy as .codex/policies/RECEIPT_LIFECYCLE.md.",
      "effort": "MEDIUM"
    },
    {
      "id": "MMD-003",
      "severity": "HIGH",
      "category": "STALE_ARTIFACT",
      "title": "BUNDLE_CATALOG.json reports 13 LFS-untracked files that are now tracked",
      "description": "BUNDLE_CATALOG.json summary.lfs_untracked_count is 13 and summary.lfs_tracking_gaps lists three gap patterns. The .gitattributes now covers all these extensions. Additionally, 13 individual catalog entries have 'lfs_tracked: false' (8 CHAT7 .part files, 2 chat_4 .zip.part files, 2 MetaBlooms_OS_VALIDATED_EXPORT .zip.part files, and 1 .rtf file). These entries are factually incorrect about current LFS tracking status. The catalog has no auto-refresh mechanism.",
      "affected_files": [
        ".codex/artifacts/BUNDLE_CATALOG.json",
        ".gitattributes"
      ],
      "recommendation": "Regenerate BUNDLE_CATALOG.json with correct lfs_tracked values. Add a 'last_validated_utc' timestamp to the catalog summary and define a staleness threshold policy.",
      "effort": "MEDIUM"
    },
    {
      "id": "MMD-004",
      "severity": "MEDIUM",
      "category": "SCOPE_GAP",
      "title": "TASK_INPUT in super-prompt is hardcoded with no substitution mechanism",
      "description": "SUPER_PROMPT_v2.2.md lines 54-68 contain a hardcoded TASK_INPUT that says 'Analyze all files in os_bundles/'. CLAUDE.md line 53 says 'Copy that prompt into your AI tool of choice' and line 54 says 'Fill in the TASK_INPUT section with your specific task'. However, the TASK_INPUT section is already filled in with a specific task, and there is no placeholder syntax, variable interpolation, or clear demarcation indicating which text is the template and which is the specific task instance. A user wanting a different task must guess which lines to replace.",
      "affected_files": [
        ".codex/policies/SUPER_PROMPT_v2.2.md",
        "CLAUDE.md"
      ],
      "recommendation": "Either (a) extract the TASK_INPUT content to a separate file (.codex/policies/TASK_INPUT.md) that the prompt includes by reference, or (b) wrap the substitutable section with clear delimiters like '--- BEGIN TASK_INPUT ---' and '--- END TASK_INPUT ---' with a documented replacement protocol.",
      "effort": "LOW"
    },
    {
      "id": "MMD-005",
      "severity": "CRITICAL",
      "category": "MISSING_SCHEMA",
      "title": "Six receipt types have no JSON schema definitions",
      "description": "BOOT.md lines 155-161 list seven receipt files in the canonical directory structure: BOOT_RECEIPT.json, TURN_RECEIPT.json, ENFORCEMENT_CAPABILITY.json, ENVIRONMENT_DECLARATION.json, EVALUATION_REPORT.json, REWRITE_REPORT.json, and SELF_VERIFICATION.json. Only BUNDLE_ENTRY.schema.json exists in .codex/schemas/. The super-prompt defines inline schema fragments for ENFORCEMENT_CAPABILITY (lines 82-88), ENVIRONMENT_DECLARATION (lines 103-109), and SELF_VERIFICATION (lines 267-278), but these are embedded in prose, not in a formal JSON Schema file. TURN_RECEIPT, EVALUATION_REPORT, and REWRITE_REPORT have NO schema at all \u2014 only prose descriptions of expected fields. Without formal schemas, validation in Phase 6 (self-verification) cannot programmatically check schema compliance for most receipts.",
      "affected_files": [
        ".codex/schemas/BUNDLE_ENTRY.schema.json",
        ".codex/policies/SUPER_PROMPT_v2.2.md",
        ".codex/kernel/BOOT.md"
      ],
      "recommendation": "Create formal JSON Schema files for each receipt type: BOOT_RECEIPT.schema.json, TURN_RECEIPT.schema.json, ENFORCEMENT_CAPABILITY.schema.json, ENVIRONMENT_DECLARATION.schema.json, EVALUATION_REPORT.schema.json, REWRITE_REPORT.schema.json, SELF_VERIFICATION.schema.json. Place all under .codex/schemas/.",
      "effort": "HIGH"
    },
    {
      "id": "MMD-006",
      "severity": "CRITICAL",
      "category": "MISSING_SCHEMA",
      "title": "MMD_REPORT.json has no schema in the governance system",
      "description": "The super-prompt Phase 2 (line 195) says 'Emit: .codex/artifacts/MMD_REPORT.json' but no schema is defined anywhere in the governance system for this artifact. The user of this report had to supply the schema externally. Any agent executing the super-prompt would have to invent a structure, making reports non-comparable across sessions.",
      "affected_files": [
        ".codex/policies/SUPER_PROMPT_v2.2.md",
        ".codex/schemas/"
      ],
      "recommendation": "Create .codex/schemas/MMD_REPORT.schema.json defining severity levels, category taxonomy, finding structure, and summary aggregation rules.",
      "effort": "MEDIUM"
    },
    {
      "id": "MMD-007",
      "severity": "CRITICAL",
      "category": "MISSING_SCHEMA",
      "title": "CLAIM_REGISTRY.json has no schema definition",
      "description": "The super-prompt Phase 0 (line 150) mandates emitting .codex/artifacts/CLAIM_REGISTRY.json with stable claim_ids, but defines no schema for it. There is no specification of what a claim_id looks like, what fields a claim entry contains, how evidence states are represented, or how NON_CLAIM entries differ structurally from real claims.",
      "affected_files": [
        ".codex/policies/SUPER_PROMPT_v2.2.md",
        ".codex/schemas/"
      ],
      "recommendation": "Create .codex/schemas/CLAIM_REGISTRY.schema.json specifying claim_id format, claim types (factual, comparative, prescriptive, architectural, design), evidence states, and the NON_CLAIM marker structure.",
      "effort": "MEDIUM"
    },
    {
      "id": "MMD-008",
      "severity": "HIGH",
      "category": "MISSING_SCHEMA",
      "title": "SEE_QUERY_LOG.json and SOURCE_LEDGER.json have no schemas",
      "description": "The super-prompt Phase 1 (lines 173-174) mandates emitting .codex/research/SEE_QUERY_LOG.json and .codex/research/SOURCE_LEDGER.json but defines no schema for either. There is no specification of query structure, source metadata, acceptance/rejection criteria fields, or how to link queries to claims.",
      "affected_files": [
        ".codex/policies/SUPER_PROMPT_v2.2.md",
        ".codex/schemas/"
      ],
      "recommendation": "Create .codex/schemas/SEE_QUERY_LOG.schema.json and .codex/schemas/SOURCE_LEDGER.schema.json.",
      "effort": "MEDIUM"
    },
    {
      "id": "MMD-009",
      "severity": "HIGH",
      "category": "EVIDENCE_GAP",
      "title": "SEE is a description, not an engine \u2014 no operational specification",
      "description": "SEE (Search for Evidence Engine) is described in BOOT.md lines 40-43 and super-prompt lines 156-177 as 'search the web and log queries' with a SOURCE-LIMITED MODE fallback. However, there is no specification of: (1) method selection logic \u2014 when to use web search vs filesystem inspection vs git history vs LFS metadata inspection, (2) source quality ranking \u2014 how to determine if a source is authoritative, (3) evidence strength classification \u2014 no taxonomy of evidence strength (e.g., direct observation, inferred, hearsay, uncorroborated), (4) conflict resolution \u2014 what happens when two sources disagree, (5) search completeness criteria \u2014 when has enough evidence been gathered, (6) self-improvement \u2014 no feedback loop from evaluation to improve future searches.",
      "affected_files": [
        ".codex/kernel/BOOT.md",
        ".codex/policies/SUPER_PROMPT_v2.2.md"
      ],
      "recommendation": "Create .codex/policies/SEE_SPECIFICATION.md defining method selection heuristics, source quality tiers, evidence strength taxonomy, conflict resolution protocol, and completeness criteria.",
      "effort": "HIGH"
    },
    {
      "id": "MMD-010",
      "severity": "HIGH",